[
  {
    "id": "OB-ATEX",
    "title": "Zonage ATEX",
    "reference": "1999/92/CE",
    "applies_to_all": false,
    "naf_specific": [
      "10",
      "20",
      "22",
      "56",
      "41",
      "43"
    ]
  },
  {
    "id": "OB-DASRI",
    "title": "DASRI",
    "reference": "CSP, art. R.1335-2",
    "applies_to_all": false,
    "naf_specific": [
      "86",
      "87",
      "88"
    ]
  },
  {
    "id": "OB-HACCP",
    "title": "PMS / HACCP",
    "reference": "Règlement (CE) n°852/2004, art. 5",
    "applies_to_all": false,
    "naf_specific": [
      "56",
      "10",
      "55"
    ]
  },
  {
    "id": "OB-TRAVAIL-NUIT",
    "title": "Suivi médical travail de nuit",
    "reference": "L3122-5",
    "applies_to_all": false
  }
]